{
  "$schema": "./fixtures.schema.json",
  "schemaVersion": "toon-rpc-fixtures-v1",
  "protocolVersion": "1.0",
  "toonCheckpoint": {
    "version": "4.1.1",
    "repository": "toon-format/spec",
    "revision": "62f16b369408180f1faf1cba7da1b46d1f336f12"
  },
  "handlers": {
    "fixture.ok": {
      "kind": "result",
      "value": {
        "ok": true
      }
    },
    "fixture.null": {
      "kind": "result",
      "value": null
    },
    "fixture.echo": {
      "kind": "echo-params"
    },
    "fixture.fail": {
      "kind": "error",
      "code": 1000,
      "message": "fixture failure"
    },
    "fixture.fail-data": {
      "kind": "error",
      "code": 1001,
      "message": "fixture failure with data",
      "data": null
    },
    "fixture.observe": {
      "kind": "result",
      "value": null
    },
    "fixture.reject-params": {
      "kind": "reject-params",
      "message": "fixture params rejected"
    },
    "fixture.internal-error": {
      "kind": "internal-error"
    },
    "fixture.minimum-code": {
      "kind": "error",
      "code": -2147483648,
      "message": "minimum application code"
    },
    "fixture.maximum-code": {
      "kind": "error",
      "code": 2147483647,
      "message": "maximum application code"
    }
  },
  "valid": [
    {
      "name": "request/positional-params",
      "direction": "server",
      "encoding": "toon",
      "input": {
        "wire": "toonrpc: \"1.0\"\nmethod: \"fixture.echo\"\nparams[2]: 1,2\nid: 1",
        "value": {
          "toonrpc": "1.0",
          "method": "fixture.echo",
          "params": [1, 2],
          "id": 1
        }
      },
      "expect": {
        "kind": "success",
        "id": 1,
        "result": [1, 2],
        "callCount": 1,
        "exactMembers": ["toonrpc", "result", "id"]
      }
    },
    {
      "name": "request/named-params",
      "direction": "server",
      "encoding": "toon",
      "input": {
        "wire": "toonrpc: \"1.0\"\nmethod: \"fixture.echo\"\nparams:\n  left: 1\n  right: 2\nid: 2",
        "value": {
          "toonrpc": "1.0",
          "method": "fixture.echo",
          "params": {
            "left": 1,
            "right": 2
          },
          "id": 2
        }
      },
      "expect": {
        "kind": "success",
        "id": 2,
        "result": {
          "left": 1,
          "right": 2
        },
        "callCount": 1,
        "exactMembers": ["toonrpc", "result", "id"]
      }
    },
    {
      "name": "request/omitted-params",
      "direction": "server",
      "encoding": "toon",
      "input": {
        "wire": "toonrpc: \"1.0\"\nmethod: \"fixture.ok\"\nid: 3",
        "value": {
          "toonrpc": "1.0",
          "method": "fixture.ok",
          "id": 3
        }
      },
      "expect": {
        "kind": "success",
        "id": 3,
        "result": {
          "ok": true
        },
        "callCount": 1,
        "exactMembers": ["toonrpc", "result", "id"]
      }
    },
    {
      "name": "request/string-id",
      "direction": "server",
      "encoding": "toon",
      "input": {
        "value": {
          "toonrpc": "1.0",
          "method": "fixture.ok",
          "id": "call-4"
        }
      },
      "expect": {
        "kind": "success",
        "id": "call-4",
        "result": {
          "ok": true
        },
        "callCount": 1,
        "exactMembers": ["toonrpc", "result", "id"]
      }
    },
    {
      "name": "request/minimum-safe-integer-id",
      "direction": "server",
      "encoding": "toon",
      "input": {
        "value": {
          "toonrpc": "1.0",
          "method": "fixture.ok",
          "id": -9007199254740991
        }
      },
      "expect": {
        "kind": "success",
        "id": -9007199254740991,
        "result": {
          "ok": true
        },
        "callCount": 1,
        "exactMembers": ["toonrpc", "result", "id"]
      }
    },
    {
      "name": "request/maximum-safe-integer-id",
      "direction": "server",
      "encoding": "toon",
      "input": {
        "value": {
          "toonrpc": "1.0",
          "method": "fixture.ok",
          "id": 9007199254740991
        }
      },
      "expect": {
        "kind": "success",
        "id": 9007199254740991,
        "result": {
          "ok": true
        },
        "callCount": 1,
        "exactMembers": ["toonrpc", "result", "id"]
      }
    },
    {
      "name": "request/null-id-receives-response",
      "direction": "server",
      "encoding": "toon",
      "input": {
        "wire": "toonrpc: \"1.0\"\nmethod: \"fixture.ok\"\nid: null",
        "value": {
          "toonrpc": "1.0",
          "method": "fixture.ok",
          "id": null
        }
      },
      "expect": {
        "kind": "success",
        "id": null,
        "result": {
          "ok": true
        },
        "callCount": 1,
        "exactMembers": ["toonrpc", "result", "id"]
      }
    },
    {
      "name": "notification/absent-id-produces-no-response",
      "direction": "server",
      "encoding": "toon",
      "input": {
        "wire": "toonrpc: \"1.0\"\nmethod: \"fixture.observe\"",
        "value": {
          "toonrpc": "1.0",
          "method": "fixture.observe"
        }
      },
      "expect": {
        "kind": "no-response",
        "callCount": 1,
        "calls": {
          "fixture.observe": 1
        }
      }
    },
    {
      "name": "notification/invalid-params-produces-no-response",
      "direction": "server",
      "encoding": "toon",
      "input": {
        "value": {
          "toonrpc": "1.0",
          "method": "fixture.reject-params",
          "params": {
            "value": 1
          }
        }
      },
      "expect": {
        "kind": "no-response",
        "callCount": 1,
        "calls": {
          "fixture.reject-params": 1
        }
      }
    },
    {
      "name": "notification/internal-error-produces-no-response",
      "direction": "server",
      "encoding": "toon",
      "input": {
        "value": {
          "toonrpc": "1.0",
          "method": "fixture.internal-error"
        }
      },
      "expect": {
        "kind": "no-response",
        "callCount": 1,
        "calls": {
          "fixture.internal-error": 1
        }
      }
    },
    {
      "name": "response/null-result-is-success",
      "direction": "server",
      "encoding": "toon",
      "input": {
        "value": {
          "toonrpc": "1.0",
          "method": "fixture.null",
          "id": 5
        }
      },
      "expect": {
        "kind": "success",
        "id": 5,
        "result": null,
        "callCount": 1,
        "exactMembers": ["toonrpc", "result", "id"]
      }
    },
    {
      "name": "error/application-code-without-data",
      "direction": "server",
      "encoding": "toon",
      "input": {
        "value": {
          "toonrpc": "1.0",
          "method": "fixture.fail",
          "id": 6
        }
      },
      "expect": {
        "kind": "error",
        "id": 6,
        "code": 1000,
        "message": "fixture failure",
        "hasData": false,
        "callCount": 1,
        "exactMembers": ["toonrpc", "error", "id"]
      }
    },
    {
      "name": "error/application-code-with-null-data",
      "direction": "server",
      "encoding": "toon",
      "input": {
        "value": {
          "toonrpc": "1.0",
          "method": "fixture.fail-data",
          "id": 7
        }
      },
      "expect": {
        "kind": "error",
        "id": 7,
        "code": 1001,
        "message": "fixture failure with data",
        "hasData": true,
        "data": null,
        "callCount": 1,
        "exactMembers": ["toonrpc", "error", "id"]
      }
    },
    {
      "name": "error/unknown-method-preserves-id",
      "direction": "server",
      "encoding": "toon",
      "input": {
        "value": {
          "toonrpc": "1.0",
          "method": "fixture.missing",
          "id": 8
        }
      },
      "expect": {
        "kind": "error",
        "id": 8,
        "code": -32601,
        "message": "Method not found",
        "hasData": false,
        "callCount": 0,
        "exactMembers": ["toonrpc", "error", "id"]
      }
    },
    {
      "name": "request/unknown-member-is-ignored",
      "direction": "server",
      "encoding": "toon",
      "input": {
        "value": {
          "toonrpc": "1.0",
          "method": "fixture.ok",
          "id": 9,
          "trace": "abc"
        }
      },
      "expect": {
        "kind": "success",
        "id": 9,
        "result": {
          "ok": true
        },
        "callCount": 1,
        "exactMembers": ["toonrpc", "result", "id"]
      }
    },
    {
      "name": "error/method-params-rejected",
      "direction": "server",
      "encoding": "toon",
      "input": {
        "value": {
          "toonrpc": "1.0",
          "method": "fixture.reject-params",
          "params": {
            "value": 1
          },
          "id": 16
        }
      },
      "expect": {
        "kind": "error",
        "id": 16,
        "code": -32602,
        "message": "fixture params rejected",
        "hasData": false,
        "callCount": 1,
        "calls": {
          "fixture.reject-params": 1
        },
        "exactMembers": ["toonrpc", "error", "id"]
      }
    },
    {
      "name": "error/internal-handler-failure",
      "direction": "server",
      "encoding": "toon",
      "input": {
        "value": {
          "toonrpc": "1.0",
          "method": "fixture.internal-error",
          "id": 17
        }
      },
      "expect": {
        "kind": "error",
        "id": 17,
        "code": -32603,
        "message": "Internal error",
        "hasData": false,
        "callCount": 1,
        "calls": {
          "fixture.internal-error": 1
        },
        "exactMembers": ["toonrpc", "error", "id"]
      }
    },
    {
      "name": "error/minimum-signed-32-bit-code",
      "direction": "server",
      "encoding": "toon",
      "input": {
        "value": {